{
  "urn": "urn:mcnet:v1:gcp:project_id=acme-prod-networking-123456,region=us-central1:attachment:projects/acme-prod-networking-123456/locations/us-central1/spokes/prod-shared-vpc-spoke-secondary",
  "native_id": "projects/acme-prod-networking-123456/locations/us-central1/spokes/prod-shared-vpc-spoke-secondary",
  "resource_type": "attachment",
  "provider": "gcp",
  "scope": {
    "provider": "gcp",
    "project_id": "acme-prod-networking-123456",
    "region": "us-central1",
    "collected_at": "2026-08-20T12:00:00Z"
  },
  "name": "prod-shared-vpc-spoke-secondary",
  "tags": {},
  "observed_at": "2026-08-20T12:00:00Z",
  "source_api": "HubServiceClient.list_spokes",
  "collection_completeness": "complete",
  "transit_hub_urn": "urn:mcnet:v1:gcp:project_id=acme-prod-networking-123456:transit-hub:projects/acme-prod-networking-123456/locations/global/hubs/acme-global-ncc-hub",
  "attached_resource_urn": "urn:mcnet:v1:gcp:project_id=acme-prod-networking-123456:network:https%3A//www.googleapis.com/compute/v1/projects/acme-prod-networking-123456/global/networks/prod-shared-vpc",
  "attached_resource_type": "network",
  "state": "inactive",
  "state_reason": "PENDING_REVIEW: spoke is awaiting review under the hub's group route-acceptance policy before route propagation begins",
  "extensions": {
    "gcp": {
      "spoke_type": "VPC_NETWORK",
      "region": "us-central1",
      "linked_resource_uris": ["https://www.googleapis.com/compute/v1/projects/acme-prod-networking-123456/global/networks/prod-shared-vpc"],
      "reasons": [
        {"code": "PENDING_REVIEW", "message": "Spoke is awaiting review under the hub's group route-acceptance policy before route propagation begins."}
      ],
      "group": "projects/acme-prod-networking-123456/locations/global/hubs/acme-global-ncc-hub/groups/default",
      "_note": "GCP NCC spokes uniquely report a structured inactive-reason (reasons[].code/message) that neither AWS Transit Gateway attachments nor Azure hub connections expose as a distinct field -- see the Attachment model's own docstring. state_reason above carries that structured reason into the one canonical free-text field available."
    }
  }
}
